{
  "$schema": "https://json-schema.org/draft/2020-12/schema",
  "title": "Web search result, version 1",
  "description": "The result member of what the source web-search answers (docs/web-search.md): links to read, and for a grounded answer the text the provider generated, kept apart from them. A result is a lead and not a document. Each value is checked on its own, with patterns written to mean the same under a JavaScript and a Python regular-expression engine. The schema is looser than the adapter in these places, and a value it admits may be one the adapter never writes: a length is counted here in characters and by the adapter in bytes of UTF-8; a link is not parsed here, so one with user information or another port is admitted; that the hits are no more than the request's maxResults, and that no link is there twice, are rules that relate values and are the adapter's; that retrievedAt is a day of the calendar is not checked; and 1.0 is the integer 1 here.",
  "type": "object",
  "additionalProperties": false,
  "required": [
    "version",
    "connection",
    "revision",
    "provider",
    "query",
    "retrievedAt",
    "kind",
    "hits"
  ],
  "properties": {
    "version": {
      "const": 1,
      "description": "the version of this form"
    },
    "connection": {
      "type": "string",
      "pattern": "^[a-z][a-z0-9-]{0,47}(?![\\s\\S])",
      "description": "the connection that was asked"
    },
    "revision": {
      "type": "string",
      "pattern": "^[a-f0-9]{64}(?![\\s\\S])",
      "description": "its revision when it was asked, and still when the answer was kept"
    },
    "provider": {
      "enum": [
        "tavily",
        "google-grounding"
      ],
      "description": "the provider of the connection"
    },
    "query": {
      "type": "string",
      "maxLength": 2000,
      "pattern": "^[^\\u0000-\\u001F\\u007F-\\u009F]+(?![\\s\\S])",
      "description": "the query of the request, as given"
    },
    "retrievedAt": {
      "type": "string",
      "pattern": "^[0-9]{4}-[0-9]{2}-[0-9]{2}T[0-9]{2}:[0-9]{2}:[0-9]{2}Z(?![\\s\\S])",
      "description": "when the answer had been read, to the second, in UTC"
    },
    "kind": {
      "enum": [
        "search-results",
        "grounded-answer"
      ],
      "description": "search-results: links a search engine returned; grounded-answer: text a model generated, with the links it was grounded in"
    },
    "hits": {
      "type": "array",
      "maxItems": 10,
      "items": {
        "$ref": "#/$defs/hit"
      },
      "description": "the links, in the provider's order; at most the request's maxResults"
    },
    "generatedAnswer": {
      "type": "string",
      "minLength": 1,
      "maxLength": 12000,
      "description": "what the model wrote, cut at 12000 bytes of UTF-8; generated text, not an excerpt of any page; absent where the model wrote none"
    },
    "attributionHtml": {
      "type": "string",
      "minLength": 1,
      "maxLength": 32000,
      "description": "the provider's attribution markup, passed through as given: markup the adapter did not write and did not read, which a consumer renders as it would any markup from elsewhere"
    },
    "queries": {
      "type": "array",
      "minItems": 1,
      "maxItems": 20,
      "items": {
        "type": "string",
        "maxLength": 2000
      },
      "description": "the searches the provider says it made, each cut at 2000 bytes of UTF-8; absent where it names none"
    }
  },
  "allOf": [
    {
      "if": {
        "properties": {
          "provider": {
            "const": "tavily"
          }
        }
      },
      "then": {
        "properties": {
          "kind": {
            "const": "search-results"
          },
          "generatedAnswer": false,
          "attributionHtml": false,
          "queries": false
        }
      },
      "else": {
        "properties": {
          "kind": {
            "const": "grounded-answer"
          },
          "hits": {
            "minItems": 1
          }
        },
        "required": [
          "attributionHtml"
        ]
      }
    }
  ],
  "$defs": {
    "hit": {
      "type": "object",
      "additionalProperties": false,
      "required": [
        "title",
        "url",
        "snippet"
      ],
      "properties": {
        "title": {
          "type": "string",
          "maxLength": 512,
          "description": "the provider's title for the link, cut at 512 bytes of UTF-8 and at a whole character; it may be empty, and it is the provider's text, which may hold any character"
        },
        "url": {
          "type": "string",
          "maxLength": 4096,
          "pattern": "^[Hh][Tt][Tt][Pp][Ss]://[^\\r\\n\\u0000]+(?![\\s\\S])",
          "description": "the provider's link as given, at most 4096 bytes; the adapter keeps a link only if it parses as an HTTPS URL that names a host, carries no user information and names no port or the port written 443; it need not be the address of the page it leads to"
        },
        "snippet": {
          "type": "string",
          "maxLength": 2000,
          "description": "the provider's excerpt, cut at 2000 bytes of UTF-8 and at a whole character; empty for a grounded answer; the provider's text, not text read from the page"
        }
      }
    }
  }
}
